{"adapter":{"id":"fixture-adapter","version":"1"},"base_system":{"base_profile_sha256":"1111111111111111111111111111111111111111111111111111111111111111","exclusions":[],"exclusions_sha256":"4f53cda18c2baa0c0354bb5f9a3ecbe5ed12ab4d8e11ba873c2f11161202b945"},"declaration_id":"f55410386765606230cb5001118ca8a3c7c8a708ffdb06304b0d8ab4cb5a0c90","entries":[{"destination":"/srv/synthetic-runtime/v2/bin","gid":0,"kind":"directory","link_text":null,"mode":"0755","nlink":null,"sha256":null,"size":null,"source":null,"target":null,"uid":0},{"destination":"/srv/synthetic-runtime/v2/lib","gid":0,"kind":"directory","link_text":null,"mode":"0755","nlink":null,"sha256":null,"size":null,"source":null,"target":null,"uid":0},{"destination":"/srv/synthetic-runtime/v2/lib/helper","gid":0,"kind":"file","link_text":null,"mode":"0644","nlink":1,"sha256":"e81d3b0e9d82feaaf5f6e55bdff24731d7eee08632ffa63801e6397290c5d20a","size":6,"source":"/srv/synthetic-runtime/v2/lib/helper","target":null,"uid":0}],"policy":{"id":"fixture-policy","version":"1"},"provider":"codex","schema":"org.agent-harness.executable-dependency-declaration.v1","subject":{"destination":"/srv/synthetic-runtime/v2/bin/codex","forwarding":"original-argv","gid":0,"kind":"file","mode":"0755","nlink":1,"sha256":"a622b10ddc23c8c9e9ec39d4833ae9b7b772ef40cb430425cb1689b76ec3490c","size":7,"source":"/srv/synthetic-runtime/v2/bin/codex","uid":0}}